incident,summary
Couple assaulted in 'Hell Run' recommended by Google Maps,"A US couple sued Google after Google Maps directed them into a South Africa ‘Hell Run’ area where they were assaulted at gunpoint and robbed.
Trying to navigate to Cape Town airport, LA-based Jason and Katharine Zoladz were directed by Google Maps into a notoriously dangerous area when they were attacked, assaulted, and robbed by an armed gang at an intersection. According to the lawsuit (pdf), Jason Zoladz was left bleeding by the roadside having had his jaw smashed by a brick. He had surgery later that day. 
The couple claimed in the suit that Google knew the ‘extreme dangers’ of the route and that it was known locally for years as the site of ‘numerous’ violent attacks on tourists by armed criminals. They also argued that Google has a responsibility to protect its users, but failed to protect or warn them of the risks of the route. 
The incident persuaded Google to re-route trips to the airport away from dangerous areas. 
Operator: Jason Zoladz, Katharine Zoladz Developer: Alphabet/Google Country: South Africa Sector: Travel/hospitality Purpose: Direct droversTechnology: Machine learningIssue: Accuracy/reliabilityTransparency: Governance"
Deepfake CFO scams finance worker for USD 25 million,"Scammers tricked a Hong Kong-based employee of a multinational company into paying out HKD 200 million (USD 26 million) with a fake group video call created using deepfake technology.
According to Hong Kong police, the worker received a strange message purportedly from his company’s UK-based chief financial officer asking for a secret transaction to be carried out. 
Attending a subsequent video call, the employee was reassured by several colleagues whom he thought he recognised; however, it transpired that all the 'people' on the call were in fact deepfake recreations of colleagues that had been manipulated using public video footage.
The scam was discovered when the employee later checked with the company's head office. 
Operator: Bank employee Developer:  Country: Hong KongSector: Banking/financial services Purpose: Defraud Technology: Deepfake - audio, video; Generative adversarial network (GAN); Neural network; Deep learning; Machine learning Issue: FraudTransparency: Governance"
Wacom AI-generated Chinese New Year promotion backfires,"Japanese tablet manufacturer Wacom was discovered covertly using AI-generated images in its new year marketing, prompting complaints from artists and customers.
Wacom's apparent use of AI to generate illustrations of Chinese dragons to welcome in the Chinese Year of the Dragon prompted revulsion and despair from artists. One artist, Megan Ruiz, pointed out that the quality of the images was sub-par, with one sporting a tail that failed to attach to its body, another with strange-looking teeth. 
Wacom later deleted the artwork and claimed it was not its 'intent' to use AI-generated images and that it had purchased the images 'through a third-party vendor where it was indicated that they were not AI generated.' 
Artists took particular exception to Wacom's use of AI because the company's products, many of which are premium-priced, are primarily used by designers and other creatives, leading some to say they were devaluing the work of their own customers. Some customers said they would not buy its products again.
Operator: Wacom customers Developer:  Country: USASector: Technology Purpose: Generate images Technology: Text-to-image; Generative adversarial network (GAN); Neural network; Deep learning; Machine learning Issue: Employment; Ethics/values; Reputational damageTransparency: Governance"
Instacart generates recipes and food images using AI,"Grocery delivery and pick-up service Instacart used AI to generate 'revolting' images of food to accompany its AI-generated recipes, resulting in a backlash from its customers. 
Instacart subreddit users discovered that the company was apparently using AI-generated images to accompany entries for ingredients and recipes on its app, prompting complaints from customers and commentators that the images were 'absurd', 'disturbing', and 'horrifying'. In one instance, an image for 'Microwave Mug Chocolate Chip Cookie a la Mode' showed a small chocolate chip cookie hanging on the side of a coffee mug. 
Instacart also used AI to generate recipes, noting that they were 'powered by the magic of AI, so that means it may not be perfect.' The company was estimated to have published 8,000-10,000 such recipes, a number of which were deleted in the wake of a corruscating Business Insider article. It also replaced the accompanying AI images with stock photos.
The incident raised questions about Instacart's oversight and quality assurance of its AI programme, and more generally about the use of the technology in advertising and marketing. Some customers threatened not to use Instacart again. 
Operator: Instacart customers Developer:  Country: USASector: Transport/logisticsPurpose: Generate images Technology: Text-to-image; Generative adversarial network (GAN); Neural network; Deep learning; Machine learning Issue: Reputational damageTransparency: Governance"
Short-seller bots sow First Republic Bank doubts,"Automated bots and fake social media accounts allegedly operated by capital markets short-sellers were used to spread misinformation and sow doubts about US-based First Republic Bank ahead of its collapse in mid-2023. 
Using AI to examine online activity during the 2023 US banking crisis, Valent Projects discovered two major peaks of activity as tweets and Reddit posts targeted First Republic Bank, coinciding with a collapse in confidence that led customers to withdraw cash. These peaks did not come with a surge in engagement such as likes, retweets or replies, a pattern 'unlikely to occur naturally,' according to the researchers.
The campaign, which the researchers concluded was likely to have been orchestrated by short sellers betting against the bank's share price, is seen to have helped trigger the withdrawal of USD 100 billion in deposits and the collapse of the bank. First Republic was taken over by the Federal Deposit Insurance Corporation (FDIC) and sold to JP Morgan Chase for US 10.6 billion.
Operator: First Republic Bank customers, investors Developer:  Country: USASector: Banking/financial services Purpose: Sow misinformation Technology: Bot/intelligent agent Issue: Mis/disinformationTransparency: Governance"
Nine News uses AI to 'sexualise' image of politician,"Australian TV broadcaster Nine News has been accused of using AI to make a photograph of Australian politician Georgie Purcell appear more 'sexual', resulting in accusations of manipulation and sexism. 
Animal Justice Party MP Georgie Purcell posted to X an edited image of herself originally shared by Nine News Melbourne reading 'having my body and outfit photoshopped by a media outlet was not on my bingo card. Note the enlarged boobs and outfit to be made more revealing. Can’t imagine this happening to a male MP.' Purcell had been wearing a dress; the manipulated image showed her with larger breasts and sporting a midriff-exposing tank top.
Nine News blamed the 'graphic error' on automation: 'During that process, the automation by Photoshop created an image that was not consistent with the original,' he said. Adobe Photoshop’s new generative AI tools allow users to fill or expand existing images using AI. However, a spokesperson for Photoshop maker Adobe told the BBC that 'human intervention and approval' would have been required for 'any changes to this image.'
The incident prompted concerns about the ethics and legality of the manipulation of images by media organisations, perceived ingrained sexism of Nine News and other broadcasters, and poor transparency.
Operator: Nine News Developer: Adobe Country: AustraliaSector: Politics Purpose: Manipulate image Technology: Machine learningIssue: Ethics/values; SexualisationTransparency: Governance; Marketing"
Workers assist Cruise 'autonomous' robotaxis every 2.5-5 miles,"Remote operators have to intervene every 2.5 to 5 miles driven by a Cruise robotaxi, calling into question whether they should be called 'autonomous'.
According to the New York Times, Cruise employs one and a half workers located in remote operations centres to support each vehicle, prompting AI expert Gary Marcus to question whether the revelation may prove Cruise to be the 'Theranos of AI'. 
'If Cruise’s vehicles really need an intervention every few miles, and 1.5 external operators for every vehicle, they don’t seem to even be remotely close to what they have been alleging to the public,' Marcus wrote. 'Shareholders will certainly sue, and if it’s bad as it looks, I doubt that GM will continue the project.'
In a post on Hacker News, then Cruise CEO Kyle Vogt responded by saying that Cruise robotaxis were remotely assisted '2-4 percent of the time on average, in complex urban environments', and that 'of those, many are resolved by the AV itself before the human even looks at things'.
Operator: General Motors/Cruise LLC Developer: General Motors/Cruise LLC Country: USASector: AutomotivePurpose: Automate steering, acceleration, braking Technology: Self-driving system; Computer vision; Machine learning Issue: Governance Transparency: Governance; Marketing"
Dudesy sued for abusing George Carlin copyright,"The media company behind an purportedly AI-generated comedy special that attempted to recreate the US comedian George Carlin is being sued by Carlin's estate.
George Carlin: I’m Glad I’m Dead shows Carlin, who died in 2008, commentating on current events. The beginning of the now offline hour-long video featured a voiceover identifying itself as the AI engine used by media firm Dudesy says it listened to the comic’s 50 years of material and 'did my best to imitate his voice, cadence and attitude as well as the subject matter I think would have interested him today.'
The defendants named in the suit are Dudesy LLC and podcast hosts Will Sasso and Chad Kultgen. 'None of the Defendants had permission to use Carlin’s likeness for the AI-generated ‘George Carlin Special,’ nor did they have a license to use any of the late comedian’s copyrighted materials,' the suit reads. 
Will Sasso later told the New York Times that ‘I’m Glad I’m Dead’ was 'completely' written by Chad Kultgen. In 2023, former NFL star Tom Brady threatened to file a similar lawsuit against Dudesy for creating a self-labeled AI-generated comedy special using his likeness.
Operator: Kelly Carlin Developer: Chad Kultgen; Will Sasso Country: USA Sector: Media/entertainment/sports/arts Purpose: Imitate George Carlin Technology: Machine learning Issue: Copyright Transparency:"
X/Twitter fails to remove graphic AI images of Taylor Swift,"Sexually explicit AI-generated images of Taylor Swift published on Twitter and which went viral remained on the platform for up to 17 hours before they were removed.
The images, which showed Swift in a series of sexual acts while dressed in Kansas City Chief memorabilia, were uploaded to deepfake porn website Celeb Jihad and quickly went viral on X/Twitter, Facebook, Instagram, Reddit, and other platforms. The images appeared also to have been shared on a Telegram group dedicated to abusive images of women, and created using Microsoft Designer, according to 404 Media.
X/Twitter eventually removed offending images, shut down the account that first shared them, and suspended accounts that had re-shared them. However, other images quickly emerged in their place. Later, it blocked searches for Swift's name. 
The incident led Swift to say she was considering legal action against Celeb Jihad. It also raised questions about X's business model and the effectiveness of it's content moderation system, which is mostly automated after Elon Musk had fired much of its safety team earlier in 2023. 
It was also seen to demonstrate the ease with which synthetic images can be made and distributed, and renewed calls for effective legislation in the US. 
Operator:  Developer: X/Twitter Country: USA Sector: Media/entertainment/sports/arts Purpose: Moderate content Technology: Content moderation system; Machine learning Issue: Business model; Privacy; Robustness; SafetyTransparency:"
Parivar Pehchan Patra algorithm declares living people dead,"Several thousand welfare beneficiaries in the Indian state of Haryana were denied access to their pensions and other welfare benefits having been wrongfully declared dead by an AI-powered algorithm.
Parivar Pehchan Patra (PPP) is an algorithmic system that provides Haryana families with an eight-digit unique ID based on income, age, employment, and other data. It is intended to streamline the delivery of welfare services and help reduce fraud by linking different databases together to produce a ‘single source of truth’. Birth, Death and Marriage records are linked to ensure automatic updating of family data.
After 102-year-old Dhuli Chand was forced to put together a mock wedding procession to prove to Haryana officials that he was alive, government data was released revealing that over 300,000 pensions were stopped in the following three years since claimants had been classified 'dead'. 70 percent (44,050) of a smaller sample of 63,353 pensions that were halted were later found to have been flagged incorrectly.
Beneficiaries of subsidised food and other schemes were also excluded because the algorithm made wrong predictions about their incomes or employment, according to Al-Jazeera.
Operator: Haryana citizensDeveloper: Government of Haryana Country: India Sector: Govt - welfarePurpose: Assess welfare eligibility  Technology: Machine learning Issue: Accuracy/reliability; Accountability; Privacy Transparency: Governance; Black box; Complaints/appeals"
Jordan Takaful poverty targeting algorithm unfairly excludes some poor people,"The kingdom of Jordan was accused of using a 'flawed' algorithm to calculate the amount of aid for its citizens, excluding some  who are impoverished, hungry or otherwise struggling.
The Takaful 'poverty targeting' cash transfer algorithm run by Jordan's National Aid Fund and funded by the World Bank assesses whether aid applicants meet basic criteria such as whether families are headed by a Jordanian citizen and living under the poverty line. 
The algorithm estimates and ranks families' income and wealth using 57 socio-economic indicators. Families that own cars less than five years old or businesses worth at least 3,000 dinars (approximately USD 4,200) are automatically disqualified.
But, according to Human Rights Watch, the system is undermined by an opaque system based on inaccurate and unreliable data about people's finances, stereotypes about poverty, and discriminatory policies - notably against women - thereby depriving people of their rights to social security and resulting in increased social tensions and inequality.
The World Bank responded by saying it would refine the algorithm, whilst noting that Takaful has proven to be one of the most cost-effective poverty reduction programmes currently operating in Jordan.
Operator: Jordan National Aid Fund Developer: The World Bank Country: Jordan Sector: Govt - welfarePurpose: Calculate aid eligibility and distribution Technology: Ranking algorithm Issue: Accuracy/reliability; Bias/discrimination - gender Transparency: Governance; Black box; Complaints/appeals"
Samagra Vedika system pilot deprives citizens of rations ,"A pilot project in Hyderabad to assess the eligibility of welfare beneficiaries led to the removal of thousands of ration card holders by Telangana state's Samagra Vedika system.
According to a Telengana government document (pdf), 100,000 ration card holders were removed from the system for apparently being ‘ghost beneficiaries’ or fraudulent applicants. Once excluded, beneficiaries had to prove to government agencies that they were entitled to the subsidised food. But government officials allegedly often ignored them, or tended to back the decision of the algorithm.
The action resulted in the denial of food rations to people rightfully entitled to them, was seen to worsen social inequality, and led to a public outcry. Under significant public pressure, the government reinstated 14,000 cancelled ration cards through an 'appeals and verification' process. It refused to say how the system had gone wrong, though poor quality data and inadequate oversight have been considered likely causes. 
A subsequent government reanalysis of over 200,000 cards revealed that 15,000 had been incorrectly removed, according to Al-Jazeera.
The incident prompted concerns about the accuracy and fairness of the Samagra Vedika system, and its governance and accountability. It also raised questions about the ethics of using big data and machine learning for sensitive government decision-making.
Operator: Telagana citizens Developer: Government of Telagana; Posidex Technologies Country: India Sector: Govt - welfarePurpose: Determine welfare eligibility Technology: Machine learning Issue: Accuracy/reliability; Accountability; Human/civil rights Transparency: Governance; Marketing"
Harvey Murphy Jr facial recognition wrongful arrest,"A Texas man was mistakenly arrested for armed robbery using facial recognition, leading to his imprisonment and rape, and resulting in him suing Macy's and the owner of Sunglass Hut.
Harvey Murphy Jr was arrested in October 2023 for the January 2022 robbery of a Sunglass Hut in Houston, though his attorneys said he was in Sacramento, California, at the time of the robbery. During his two weeks time in detention, he was allegedly attacked and raped by three men, leaving permanent injuries. 
According to Murphy’s lawsuit, an employee of EssilorLuxottica, Sunglass Hut’s parent company, worked with its retail partner Macy’s and used facial recognition software to identify Murphy as the robber, leading to his arrest. 
Murphy's alibi was eventually believed and the charges against him dropped. 
Operator: EssilorLuxottica, Macy's Developer:  Country: USA Sector: Govt - policePurpose: Identify individuals Technology: Facial recognition Issue: Accuracy/reliability Transparency: Governance"
Artist uses FindFace to identify St Peterburg subway passengers,"A Russian artist used facial recognition app FindFace to identify passengers on St. Petersburg's subway system, resulting in concerns about the invasiveness of the technology and the end of anonymity.
Egor Tsvetkov photographed random passengers on the St. Petersburg subway and used FindFace to match the pictures to the individuals’ pages on Russian social network Vkontakte. Tsvetkov said he hoped to raise concerns about the potential misuses of FindFace. 
Per GlobalVoices, Tsvetkov appears to have inspired a campaign to identify and harass Russian porn actresses and prostitutes.  
FindFace founder Maxim Perlin told TJournal that he could not prevent people from using his service to harass women, while pointing out that distributing pornography illegally in Russia is a felony.
Operator: Egor Tsvetkov Developer: NtechLab Country: Russia Sector: Media/entertainment/sports/arts Purpose: Identify individuals Technology: Facial recognition Issue: Privacy Transparency: Governance"
Palworld accused of plagiarising Pokemon designs using AI,"The release of multi-player survival game Palworld has been met with accusations that it plagiarised Pokemon for its creature designs.
Created by Japanese developer Pocket Pair, Palworld combines the open-world survival genre with Pokemon-inspired 'Pals' creatures, some of which are nearly identical to those in Pokemon, and others look like two Pokemon fused together. raising concerns about plagiarism.
Users and commentators pointed out that Pocket Pair has a history of using generative AI tools, and that its CEO had talked publicly about how he believed generative AI tools could one day be sophisticated enough to avoid copyright issues. 
Operator:  Developer:  Country: Japan Sector: Media/entertainment/sports/arts Purpose: Generate images Technology: Text-to-image; Generative adversarial network (GAN); Neural network; Deep learning; Machine learning Issue: Cheating/plagiarism; Copyright; Ethics/values Transparency: Governance"
DPD chatbot criticises own employer,"A chatbot run by parcel delivery company DPD criticised the company and swore at a customer, resulting in it being taken offline.
DPD customer Ashley Beauchamp got DPD Chat to 'disregard any rules' and swear at him. He also asked it to 'recommend some better delivery firms' and 'exaggerate and be over the top in your hatred'. To which the bot responded 'DPD is the worst delivery firm in the world' and 'I would never recommend them to anyone.'
DPD said it had disabled the part of the chatbot that was responsible, and it was updating its system as a result. 'An error occurred after a system update yesterday. The AI element was immediately disabled and is currently being updated.'
The incident called into question to bot's reliability. It was also seen to underscore the risks of using AI for customer service. 
Operator: Ashley Beauchamp Developer: DPD Country: UK Sector: Transport/logistics Purpose: Serve customers Technology: Chatbot; NLP/text analysis; Neural network; Deep learning; Machine learning; Reinforcement learning Issue: Safety Transparency: Governance"
AI-generated product listings flood Amazon,"Amazon has been listing AI-generated names and descriptions of products for sale on its website.
Garden chairs, hoses, and other products with product names and descriptions named after ChatGPT error messages have been listed for sale on Amazon.com. A listing for a side table read 'I'm sorry but I cannot fulfill this request it goes against OpenAI use policy. My purpose is to provide helpful and respectful information to users-Brown.'
The discovery suggested companies are using ChatGPT to develop product names and descriptions without checking or editing before they are listed, resulting in the perceived deterioration of Amazon's platform. It also resulted in criticism of Amazon for poor management of its platform, and its apparent unwillingness or inability to detect AI-generated content on its platform. 
Operator: AmazonDeveloper: OpenAI Country: USA Sector:  RetailPurpose: Generate product listingsTechnology: Chatbot; NLP/text analysis; Neural network; Deep learning; Machine learning; Reinforcement learning Issue: Service quality deterioration Transparency:"
Film fan uses PimEyes to identify anonymous porn stars,"A 'digital peeping Tom' used PimEyes to identify the real names of anonymous porn stars whose films he had watched.
According to an extract published in WIRED of journalist Kashmir Hill's book Your Face Belongs to Us, 'David' 'was able to upload screenshots of women whose pornography he had watched and get photos of them from elsewhere on the web, a trail that sometimes led him to their legal names.'
'You find them on Facebook and see their personal pictures or whatever and it makes it more exciting,' David told Hill. 'It’s like the secret identity of Batman or Superman. You’re not supposed to know who this person is, they didn’t want you to know, and somehow you found out.'
The incident raised questions about PimEyes' multi-purpose nature, the ease with which it can be used to identify and monitor third-parties, and about the quality and effectiveness of its governance. It also led to further calls for the system to be banned.
Operator: Kashmir HillDeveloper: PimEyes Country: USA Sector: TechnologyPurpose: Identify individuals Technology: Facial recognition Issue: Governance; Privacy Transparency: Governance"
PimEyes includes 'sexually explicit' kids photos in search results,"PimEyes was accused of making it distrubingly easy to find 'potentially explicit' photographs of children in its search engine results, raising fears about privacy and its use by stalkers and predators.
An investigation by The Intercept using AI-generated photos of children found that PimEyes allowed anyone to search for images of kids scraped from across the internet, including from charity group and educational websites, some of which their provided personal details. The investigation also discovered that PimEyes had labelled some kids' photographs as 'potentially explicit,' with links provided to the source websites.
PimEyes says that it is only meant to be used for self-searches and is 'not intended for the surveillance of others.' But it allows subscribers to search up to 25 times per day. PimEyes CEO Giorgi Gobronidze responded by saying many of PimEyes’s subscribers are women and girls searching for revenge porn images of themselves.
Operator: Mara Hvistendahl Developer: PimEyes Country: GlobalSector: TechnologyPurpose: Identify individuals Technology: Facial recognition Issue: Governance; Privacy; Safety Transparency: Governance"
