incident,summary
"PimEyes sued in Illinois, USA, for privacy violations","A group of five Illinois residents filed a class-action lawsuit against PimEyes for collecting, scanning, and using their facial images, and those of millions of other Americans, without consent. 
The residents accused PimEyes of 'intentional or reckless' privacy abuse, and of violating the Illinois Biometric Information Privacy Act (BIPA) and causing them 'great and irreparable injury'. They also argued the company had failed to explain its data management policies.
The complaint, which seeks USD 15,000 for each resident harmed, named the company, its cofounders Lucasz Kowalczyk and Denis Tatina, and its current CEO Giorgi Gobronidze, as defendants.
BIPA makes it illegal for companies to collect or store data, including data about Illinois residents' faces, without their consent. It also states that visitors must be informed in writing of the specific purpose of why the biometric data is being collected, how long it will be stored, and that companies must receive a written release from visitors for the collection of biometric data. 
Operator: Amy Newton, Amanda Curry, Manuel Clayton, Misty McGraw, Nicholas Clayton, Illinois residents Developer: PimEyes Country: USA Sector: TechnologyPurpose: Identify individuals Technology: Facial recognition Issue: GovernancePrivacy Transparency: Governance"
German privacy watchdog investigates PimEyes for privacy abuse,"The data regulator of German state Baden-Württemberg announced it had launched an investigation into PimEyes for its processing of biometric data. 
PimEyes was asked by the State Commissioner for Data Protection and Freedom of Information in the state of Baden Württemberg to provide detailed information on its processing of data. The investigation followed reports in the German media in 2021 alleging that PimEyes had been scraping and scanning images from social media sites, and storing biometric data. 
PimEyes had stated in a November 2021 response to the Commissioner that it only processed publicly available images and that it could not assign them to identifiable persons - a statement the regulator had found inadequate and which constituted a danger to the rights and freedoms of German citizens under the EU's General Data Protection Regulation. 
Operator:  Developer: PimEyes Country: Germany Sector: Technology Purpose: Identify individuals Technology: Facial recognition Issue: Governance; Privacy Transparency: Governance"
"UK pressure group accuses PimEyes of surveillance, privacy abuse","UK privacy advocacy group Big Brother Watch filed a complaint with the country's privacy watchdog over the facial recognition search engine PimEyes. 
In a formal complaint (pdf) to the UK's Information Commissioner's Office (ICO), Big Brother Watch accused PimEyes of unlawfully processing the biometric data of millions of UK citizens, arguing it failed to obtain permission from those whose images had been analysed. 
It went to say that PimEyes enabled 'surveillance and stalking on a scale previously unimaginable' by making it easy for users to identify where an individual worked or lived. The tool, it said, could easily be used by potential employers, university admissions officers, domestic abusers or stalkers, and could threaten 'end anonymity as we know it'.
PimEyes CEO Giorgi Gobronidze responded by saying the service posed fewer stalking risks than social media services. In May 2023, the ICO said (pdf) it had decided not to formally investigate PimEyes, and confirmed that the company was being investigated by another data protection authority. 
Operator: Big Brother WatchDeveloper: PimEyes Country: UK Sector: TechnologyPurpose: Identify individuals Technology: Facial recognition Issue: Governance; Privacy; Safety; Surveillance Transparency: Governance"
PimEyes scrapes images from social media platforms,"Facial recognition search engine PimEyes came under fire for processing photographs scraped from major social media platforms. 
A report (in English, German) by digital rights organisation Netzpolitik discovered that PimEyes regularly scraped content from Instagram, YouTube, TikTok, Twitter and Russian social network vKontakte - a claim that a PimEyes spokeperson said was untrue. The report prompted some social media companies to send legal demands that PimEyes stop using their data.
The incident raised questions about the legality of PimEyes under the EU's General Data Protection Regulation, and the danger it poses from stalkers and other people misusing it. It also resulted in questions about the implications for individual name and image rights, and a call for a moratorium on commercial facial recognition systems in the European Parliament.
Operator: Daniel Laufer, Sebastian Meineck Developer: PimEyes Country: GermanySector: TechnologyPurpose: Identify individuals Technology: Facial recognition Issue: Governance; Privacy Transparency: Governance"
"PimEyes scrapes and uses non-consensual, explicit photos","Facial recognition search engine PimEyes was found to have scraped and used sexually explicit photographs of a user, which she was then unable to have removed from its system.
In February 2022, Cher Scarlett discovered that PimEyes surfaced pornographic photos of herself that had been taken when she was a teenager, unexpectedly forcing her to re-live an unpleasant period of her life. However, she tried and failed to have the images removed from the system's search results, despite the site promising to scrub images of her from its database under its Open Plus plan.
PimEyes director Giorgi Gobronidze responded: 'The problem isn’t that there is a search engine that can find these photos; the problem is there are the photos and there are people who actually uploaded and did it on purpose.'
The incident highlighted PimEyes' was promising more than it could deliver, and drew attention to the inaccessibility of its opt-out form. It also showed how easily facial recognition technology can lead to unexpected harms that may be impossible to undo, CNN observed.
Operator: Cher ScarlettDeveloper: PimEyes Country: USA Sector: Technology Purpose: Identify individuals Technology: Facial recognition Issue: Governance; Privacy Transparency: Governance"
PimEyes steals images of dead people to train facial recognition system,"Facial recognition search engine PimEyes used stolen images of dead people on Ancestry.com to train its algorithm.
Software engineer Cher Scarlett discovered images of her sister, her mother and great-great-great grandmother whilst looking for photographs of herself on PimEyes. Scarlett said the photos appeared to have been taken from images that she and her family had personally uploaded to Ancestry.com.
Ancestry.com's terms prohibit 'scraping data, including photos, from Ancestry's sites and services as well as reselling, reproducing, or publishing any content or information found on Ancestry.' 
PimEyes director Giorgi Gobronidze responded that the site's opt-out feature, which allows users to restrict specific images of themselves from being used, 'will not work with 100 percent efficiency always,' and that the site would stop drawing data from Ancestry.com.
The incident raised concerns about PimEyes' ethics, its use of personal biometric data without permission to train its facial recognition system, and the fact that it was abusing Ancestry.com's terms. 
Operator: Cher Scarlett Developer: PimEyes Country: USA Sector: Technology Purpose: Identify individuals Technology: Facial recognition Issue: Ethics/values; Governance; Privacy Transparency: Governance"
Mahindra AI influencer pulled after jobs complaints,"Formula E racing team Mahindra was accused of preferring to use an AI-generated 'influencer' to promote itself over a real human being, triggering a backlash and resulting in the team jettisoning its digital creation.
'Ava', a digital approximation of an attractive young woman, was unveiled by Mahindra on Instagram in December 2023 as the company's 'artificial intelligence ambassador' in order to 'fuel inclusion through AI innovation'. However, users quickly took to social media to complain strongly that the initiative was inappropriate. 'Motorsport companies/teams will do anything but hire actual women,' quipped one Instagram user. 
Mahindra pulled Ava from the internet in January 2024. 'Your comments holds tremendous value. We have listened, understood and decided to discontinue the project,' Mahindra Racing CEO Frederic Bertrand acknowledged.
Operator: Mahindra Racing Developer: Mahindra Racing Country: Global Sector: Media/entertainment/sports/arts Purpose: Promote Mahindra Racing Technology: Deepfake - image; Generative adversarial network (GAN); Neural network; Deep learning; Machine learning Issue: Employment Transparency: Governance"
AI hiring chatbot hack violates applicants' privacy,"A group of hackers gained access to AI recruitment chatbot Chattr, revealing sensitive information about job applicants, fast food franchises, and Chattr itself.
Pseudonymous hacker MRBruh and others discovered that Chattr had inadvertently exposed data about itself, its customers - specifically Chick-fil-A and Subway - and their job applicants, through an incorrect Firebase configuration, including personal names, telephone numbers, email addresses, passwords, and messages.
The hack also revealed how Chattr's system worked, including the AI appearing to have the ability to accept or deny job applicants automatically. Chattr secured its system after the hack was made public, though failed to acknowledge publicly the incident.
The incident prompted suggestions that Chattr is likely one of many AI companies to have overlooked security and data privacy in the rush to get their products to market.
Operator: Applebees, Arbys, Chick-fil-A, Dunkin Donuts, IHOP, KFC, Shoneys, Subway, Tacobell, Target, Wendys Developer: Chattr Country: USA Sector: Business/professional services; Food/food services Purpose: Recruit employees Technology: Chatbot; NLP/text analysis; Neural network; Deep learning; Machine learning; Reinforcement learning Issue: Confidentiality; Privacy; Security Transparency: Governance"
Population One stranger sexually abuses Chanelle Siggins,"A female gamer reported being sexually abused by another player on virtual reality game platform Population: One her Oculus Quest virtual reality headset.
Logging into the Meta-owned Population: One app, Chanelle Siggens reported being approached by another player, who then 'simulated groping and ejaculating onto her avatar.' Chanelle said she was stunned by the incident and distanced her avatar, only to be groped by a different user one hour later. She later reported the issue to Meta.
The incident prompted concerns about the safety of the Population: One app, and about Meta's metaverses more generally. Lawyers also highlighted the likely lack of legal remedy when there is no actual physical 'touching' involved.
Operator: Chanelle Siggins Developer: Meta/Big Box VRCountry: USA Sector: Media/entertainment/sports/arts Purpose: Provide virtual social experience Technology: Virtual reality; Safety management system Issue: Safety Transparency: Governance"
Teen distributes AI-generated nude pictures of Issaquah students,"A teenage boy used AI to generate nude images of his female classmates and a member of staff at Issaquah High School, Seattle, and sent them round the school.
The images were created with an unnamed web-based nudification app, which automatically edits photos of women to make them appear naked. A student reportedly discovered the app on TikTok and then posted some of nudified photographs on Snapchat or showed them to other students over lunch at the school.  
The school referred the incident to the local police force, which launched an investigation. Media reports later indicated that no charges had been levelled against the perpetrator. 
The incident was seen to highlight the ease with which harmful deepfake images can be made and circulated, and the lack of local or federal US laws directly addressing the creation and distribution of deepfake images intended to harass or otherwise harm other people. 
Operator:  Developer:  Country: USA Sector: EducationPurpose: Harrass/intimidate/shame Technology: Deepfake - image; Generative adversarial network (GAN); Neural network; Deep learning; Machine learning Issue: Accountability; Safety Transparency:"
Deepfake Taylor Swift offers free Le Creuset cookware scam,"Fake adverts generated using AI used the likeness of Taylor Swift appearing to endorse a fake Le Creuset cookware giveaway to steal money and data.
In one of the videos, 'Swift' says 'Hey y'all, it's Taylor Swift here. Due to a packaging error, we can't sell 3,000 Le Creuset cookware sets. So I'm giving them away to my loyal fans for free.' Users were then directed from the ads, which ran on Facebook, tikiTok and other sites, to survey questions requesting personal information and a payment that supposedly covers shipping costs for the 'free' product. 
According to the New York Times, the fake promotional videos featured an uncanny Swift lookalike that was created with AI technology to replicate her appearance and voice. Computer science experts said the scam was most likely developed using text-to-speech software. 
Le Creuset said it had no association with Swift. The scammers remain unidentified.